{"audit":{"events_count":10,"tail_digest":"0xdef1234567890123456789012345678901234567890123456789012345678901"},"company_commitment_root":"0x1231234567890123456789012345678901234567890123456789012345678901","created_at":"2025-11-24T12:00:00Z","policy":{"hash":"0xabc1234567890123456789012345678901234567890123456789012345678901","name":"policy.b.v1","version":"lksg.v1"},"proof":{"status":"ok","type":"mock"},"signatures":[],"supplier_root":"0xabc1234567890123456789012345678901234567890123456789012345678901","ubo_root":"0xdef1234567890123456789012345678901234567890123456789012345678901","version":"manifest.v1.0"}